,title,view,channel,uploadtime,length,link,subscriber,like,dislike
0,"Coronavirus: 'Get prepared as soon as you can', says Italian doctor",528K views,Sky News,8 hours ago,9:32,https://www.youtube.com/watch?v=61-gFtHJOd8,1.89M,"8,297",278
1,WATCH LIVE: Trump gives coronavirus update,430K views,Washington Post,Streamed 8 hours ago,3:41:40,https://www.youtube.com/watch?v=yH4cp4dssGw,1M,"3,088","1,275"
2,Coronavirus special: Are we doing enough?,576K views,Channel 4 News,1 day ago,45:14,https://www.youtube.com/watch?v=C98FmoZVbjs,1.17M,"4,633",587
3,Coronavirus outbreak: Donald Trump declares national emergency over COVID-19 | FULL,634K views,Global News,Streamed 1 day ago,1:12:36,https://www.youtube.com/watch?v=HMGHiI44-XY,1.25M,"4,407","1,215"
4,Coronavirus: Europe at the epicentre of the pandemic - BBC News,1.1M views,BBC News,1 day ago,11:51,https://www.youtube.com/watch?v=IQdYDkwtvoo,6.6M,"8,246","1,113"
5,Infection Rate Charts Forecast Steep Rise In US Coronavirus Cases | Rachel Maddow | MSNBC,391K views,MSNBC,22 hours ago,5:48,https://www.youtube.com/watch?v=m2HgeK73ctU,2.45M,"4,264",298
6,Iran is building a massive grave for coronavirus victims,365K views,Washington Post,1 day ago,3:43,https://www.youtube.com/watch?v=fjuWyXzKBIw,1M,"2,408",447
7,"Coronavirus outbreak: Canadians urged not to ""panic buy""; Should schools close over COVID-19?",84K views,Global News,1 day ago,3:27,https://www.youtube.com/watch?v=KqM8rHkMUT8,1.25M,673,57
8,"WHO says Europe new coronavirus pandemic epicentre as global covid-19 death toll passes 5,000",399K views,Channel 4 News,1 day ago,29:58,https://www.youtube.com/watch?v=vsV_PJ3txn8,1.17M,"2,730",183
9,What the 1918 influenza pandemic can teach us about the coronavirus outbreak,25K views,Washington Post,1 day ago,3:44,https://www.youtube.com/watch?v=-B5YCQamLes,1M,356,17
10,Coronavirus controversy: Chinese official suggests US is responsible,556K views,Fox News,1 day ago,2:44,https://www.youtube.com/watch?v=hZftihVyq9E,4.49M,"3,451","1,063"
11,Miami mayor who tested positive for coronavirus speaks on quarantine experience,134K views,ABC News,1 day ago,5:27,https://www.youtube.com/watch?v=Lw1svqRG5bU,7.93M,"1,217",82
12,Hungry monkeys brawl over food as coronavirus hits tourism in Thailand,552K views,Guardian News,1 day ago,0:41,https://www.youtube.com/watch?v=22JgHBb-0dg,857K,"1,736",97
13,Trump Holds News Conference On Coronavirus Pandemic | NBC News (Live Stream Recording),3M views,NBC News,Streamed 1 day ago,2:16:48,https://www.youtube.com/watch?v=q_WM_pMp0Hg,2.02M,"20,044","8,205"
14,Chinese foreign ministry spokesman claims US army brought coronavirus to Wuhan,114K views,South China Morning Post,1 day ago,1:55,https://www.youtube.com/watch?v=whJwOkeBV5c,943K,"1,447",704
15,"Disney theme parks, American landmarks close amid coronavirus l ABC News",98K views,ABC News,1 day ago,4:20,https://www.youtube.com/watch?v=xGpew-tPga4,7.93M,661,111
16,Millions across the globe on lockdown over coronavirus,147K views,ABC News,1 day ago,6:20,https://www.youtube.com/watch?v=6izmzP-cFBU,7.93M,"1,782",128
17,"ABC News Prime: Coronavirus national emergency, life under quarantine, stock market",301K views,ABC News,Streamed 1 day ago,1:00:33,https://www.youtube.com/watch?v=wDbyThHkctA,7.93M,"2,173",328
18,Coronavirus: How the UK is following its own path to battle the pandemic,523K views,The Telegraph,1 day ago,3:01,https://www.youtube.com/watch?v=f6jYyCX2aUs,943K,"2,986","3,003"
19,Gov. DeWine says Ohio estimated to have over 100K cases of coronavirus,352K views,Fox News,1 day ago,5:18,https://www.youtube.com/watch?v=HnjvX8oLBdo,4.49M,"2,450",952
20,U.K. Prime Minister Boris Johnson delivers grim coronavirus warning,136K views,CBS This Morning,1 day ago,2:36,https://www.youtube.com/watch?v=d9UKDjoOfEw,1.24M,488,132
21,Coronavirus update: Thursday 12 March | ITV News,268K views,ITV News,2 days ago,1:21,https://www.youtube.com/watch?v=ILsobeNEtwA,442K,"1,509",275
22,Coronavirus outbreak: Justin Trudeau addresses his wife's COVID-19 diagnosis | FULL,358K views,Global News,Streamed 1 day ago,52:54,https://www.youtube.com/watch?v=SjEgtT98jqk,1.25M,"2,637",829
23,"Coronavirus Impacts Tom Hanks, the NBA and Monkeys in Thailand | The Daily Show",1.7M views,The Daily Show with Trevor Noah,1 day ago,6:24,https://www.youtube.com/watch?v=4IlwdyacDZg,6.61M,"37,741","1,022"
24,Normal Life Comes To A Halt For Americans In Response To Coronavirus | TODAY,1.3M views,TODAY,1 day ago,13:49,https://www.youtube.com/watch?v=Qn0RfE4aruk,1.79M,"10,137","1,285"
25,"Trump outlines U.S. response to coronavirus outbreak, restricts travel from Europe | ABC News",1.2M views,ABC News,3 days ago,4:04,https://www.youtube.com/watch?v=qyVX-pu-ZDk,7.93M,"10,649","2,505"
26,'America's not safe' - Leading coronavirus expert on Donald Trump's response to Covid-19,294K views,Channel 4 News,1 day ago,16:48,https://www.youtube.com/watch?v=PwQR7vN8sNU,1.17M,"3,929","1,717"
27,"How the U.S. plans to correct the ""failing"" coronavirus testing system",105K views,CBS This Morning,1 day ago,6:44,https://www.youtube.com/watch?v=InsBOaHg8IY,1.24M,591,104
28,The Virus: latest updates on coronavirus | ABC News,526K views,ABC News (Australia),1 day ago,15:23,https://www.youtube.com/watch?v=Dsgsj_E8tl4,932K,"3,679",564
29,FULL SPEECH: President Trump address the nation on coronavirus (9 minutes),335K views,WPTV News | West Palm Beach Florida,3 days ago,9:31,https://www.youtube.com/watch?v=mii6NydPiqI,136K,"2,652",720
30,Watch live: Trump addresses the country over coronavirus response,288K views,CBS News,Streamed 3 days ago,14:31,https://www.youtube.com/watch?v=pdO2HEtv92c,2.4M,"2,407",864
31,Mike Breen Announces the NBA Suspended the Season Because of the Coronavirus,157K views,Bleacher Report,3 days ago,0:43,https://www.youtube.com/watch?v=Z9IfFHlTX-k,1.73M,"2,065",49
32,"Coronavirus sends market plummeting, halting sports, travel | Nightline",108K views,ABC News,1 day ago,8:58,https://www.youtube.com/watch?v=hiO4WZW1MKk,7.93M,"1,085",117
33,Coronavirus: Do UK measures go far enough?,389K views,Sky News,1 day ago,3:44,https://www.youtube.com/watch?v=2N-Vbz_HJt0,1.89M,"2,676","1,327"
34,Trump declares 'national emergency' for coronavirus,1.4M views,CNN,1 day ago,10:40,https://www.youtube.com/watch?v=OtAQJjN1kcg,8.77M,"8,907","3,023"
35,Trump suspends travel from Europe over coronavirus fears (Entire address to nation),701K views,CNN,3 days ago,9:31,https://www.youtube.com/watch?v=EhP2JMgAwuE,8.77M,"7,074","2,728"
36,"Trump, Who Has Been Exposed To Coronavirus, Tries To Reassure The Public That He's In Control",1.2M views,The Late Show with Stephen Colbert,1 day ago,5:02,https://www.youtube.com/watch?v=6dYS-iyw8vQ,7.26M,"25,425",725
37,Nearly 200 people die in Italy in last 24 hours from coronavirus,919K views,ABC News,2 days ago,4:14,https://www.youtube.com/watch?v=cZciLknWNsg,7.93M,"5,414",565
38,Coronavirus: India issues travel restrictions | DW News,162K views,DW News,1 day ago,7:30,https://www.youtube.com/watch?v=c4cVyqrIhKU,1.08M,"1,015",74
39,"Gatherings and travel cancelled, as Peter Dutton tests positive to coronavirus | ABC News",146K views,ABC News (Australia),1 day ago,5:57,https://www.youtube.com/watch?v=u7vBCfxe5BM,932K,756,179
40,First Take discusses the impact of the coronavirus on the sports world,308K views,ESPN,1 day ago,6:37,https://www.youtube.com/watch?v=5dXjpjrDhvY,6.79M,"2,677",131
41,Coronavirus: Boris Johnson holds press conference after Cobra meeting – watch in full,260K views,Guardian News,Streamed 2 days ago,1:10:58,https://www.youtube.com/watch?v=xRadMzCKnCU,857K,"1,132",541
42,Trump suspends travel from Europe to battle coronavirus,570K views,Los Angeles Times,3 days ago,9:41,https://www.youtube.com/watch?v=KYVy_0yUSXM,276K,"7,950","1,417"
43,UK moves from contain to delay in battle against coronavirus,321K views,Channel 4 News,2 days ago,23:48,https://www.youtube.com/watch?v=HZqnccEI9oc,1.17M,"1,677",316
44,Coronavirus: contain and delay phases Explained - BBC News,441K views,BBC News,1 day ago,8:16,https://www.youtube.com/watch?v=bvQW8YkBVhQ,6.6M,"3,211",297
45,State of emergency declared in New York City over coronavirus,1.7M views,ABC News,2 days ago,6:28,https://www.youtube.com/watch?v=T6bjC8R2pUw,7.93M,"16,649","1,462"
46,COVID-19: Tenth patient dies as UK coronavirus cases hit 590,314K views,Sky News,2 days ago,5:33,https://www.youtube.com/watch?v=1xpEt20PPbQ,1.89M,"2,343",208
47,"Donovan Mitchell second NBA player to test positive for coronavirus, per report | CBS Sports HQ",210K views,CBS Sports,2 days ago,7:32,https://www.youtube.com/watch?v=NQ638csGhI8,242K,"1,078",88
48,Americans See Massive Disruptions To Daily Life As Coronavirus Spreads - Day That Was | MSNBC,100K views,MSNBC,1 day ago,5:32,https://www.youtube.com/watch?v=-SV8a9lGGk8,2.45M,"1,273",87
49,"Asians facing discrimination, violence amid coronavirus outbreak",382K views,ABC News,2 days ago,8:01,https://www.youtube.com/watch?v=ljIuWWLHNlA,7.93M,"4,735",868
50,Coronavirus: Can herd immunity protect the population? - BBC Newsnight,118K views,BBC Newsnight,2 days ago,6:27,https://www.youtube.com/watch?v=blkDulsgh3Q,522K,960,234
51,‘I’m surprised we’re not moving sooner’ on coronavirus - Former UK Health Secretary Jeremy Hunt,714K views,Channel 4 News,2 days ago,10:40,https://www.youtube.com/watch?v=3rmMh2pLKAc,1.17M,"6,333",563
52,Living with Coronavirus (COVID-19) Symptoms & Treatments,203K views,Audioholics,2 days ago,13:16,https://www.youtube.com/watch?v=iQ9Su-TO3Sw,109K,"5,349",132
53,President Trump addresses the nation on US response to coronavirus – 3/11/2020,119K views,CNBC Television,Streamed 3 days ago,10:46,https://www.youtube.com/watch?v=EnHo-eYJWg4,448K,"1,153",297
54,WATCH: President Duterte addresses the nation on coronavirus actions | ABS-CBN News,1M views,ABS-CBN News,2 days ago,49:12,https://www.youtube.com/watch?v=Gj_K7vy1qNg,8.56M,"11,141",757
55,Top health official on US response to coronavirus pandemic,275K views,ABC News,2 days ago,8:19,https://www.youtube.com/watch?v=9qZehXrLq6g,7.93M,"2,045",237
56,NBA to consider hiatus due to coronavirus – Woj | SC with Stephen A. Smith,359K views,ESPN,3 days ago,6:26,https://www.youtube.com/watch?v=6l4KEsxOAlM,6.79M,"3,364",101
57,Effects of Coronavirus Panic Reach Far and Wide,835K views,Inside Edition,1 day ago,3:07,https://www.youtube.com/watch?v=9pAcWPZRVSo,7.25M,"16,933",552
58,Coronavirus: Is it too late to stop it? | UpFront,95K views,Al Jazeera English,1 day ago,26:00,https://www.youtube.com/watch?v=rtSJBETsOqM,4.72M,915,153
59,"LIVE: Coronavirus death toll, infections and recoveries",275K views,South China Morning Post,Streamed 2 days ago,7:59:15,https://www.youtube.com/watch?v=1fw5Ldvxc9Y,943K,"1,371",163
60,How fast can coronavirus spread? A statistics professor explains,13K views,syracuse.com,1 day ago,3:19,https://www.youtube.com/watch?v=d7WO24GGYxo,35.1K,101,5
61,Coronavirus outbreak: Joe Biden says U.S. public lacks confidence in Trump's COVID-19 response,108K views,Global News,Streamed 2 days ago,18:49,https://www.youtube.com/watch?v=YLi5QqxdIU4,1.25M,"1,151","1,344"
62,Number Of Coronavirus Positive Cases Rise To 81 | Panchnama | ABP News,311K views,ABP NEWS,1 day ago,8:05,https://www.youtube.com/watch?v=eimTbAW4UnY,19.6M,"2,324",327
63,Trump declares National Emergency over coronavirus,1.7M views,Fox News,Streamed 1 day ago,1:12:37,https://www.youtube.com/watch?v=G6HbxcCb-7g,4.49M,"21,426","1,555"
64,Mark Cuban Reacts To NBA Suspending Season Indefinitely Because Of Coronavirus,741K views,Bleacher Report,3 days ago,3:24,https://www.youtube.com/watch?v=HxaPga-WD1U,1.73M,"5,534",171
65,Metro Manila to be placed on lockdown due to coronavirus outbreak,473K views,Rappler,2 days ago,3:38,https://www.youtube.com/watch?v=buS1sRfJfTw,564K,"2,771",428
66,Former Vice President Joe Biden lays out plan to combat coronavirus | ABC News,67K views,ABC News,2 days ago,4:01,https://www.youtube.com/watch?v=4I1vXnbV9GE,7.93M,856,"1,510"
67,Meanwhile... France Claims Cocaine Will Not Protect You From The Coronavirus,1.5M views,The Late Show with Stephen Colbert,2 days ago,5:29,https://www.youtube.com/watch?v=wE442HjJGRo,7.26M,"24,815","1,431"
68,Coronavirus update: Wednesday 11 March | ITV News,345K views,ITV News,3 days ago,1:18,https://www.youtube.com/watch?v=0ovMBrJmbK8,442K,"2,192",239
69,"Coronavirus Update: Europe Travel Ban, Tom Hanks, NBA Suspends Games - Day That Was | MSNBC",344K views,MSNBC,2 days ago,5:18,https://www.youtube.com/watch?v=UJWkExxcTd0,2.45M,"1,745",859
70,Mark Cuban reacts to NBA suspending season due to coronavirus | NBA on ESPN,314K views,ESPN,3 days ago,3:17,https://www.youtube.com/watch?v=b2-wU42KJ0c,6.79M,"3,036",80
71,Coronavirus expert says he has second thoughts about flying,820K views,CNN,1 day ago,9:34,https://www.youtube.com/watch?v=63M9ZQd2B7M,8.77M,"7,267",804
72,Americans Try To Leave Spain Before Coronavirus Ban: 'I Just Hope To Be Able To Get Home' | NBC News,106K views,NBC News,2 days ago,1:46,https://www.youtube.com/watch?v=gQMbyvIXYQk,2.02M,564,121
73,Coronavirus: Johnson warns 'many more families are going to lose loved ones',296K views,Guardian News,2 days ago,1:46,https://www.youtube.com/watch?v=PA-MsoqRY5k,857K,895,717
74,Nicola Sturgeon Says Coronavirus Spread is Inevitable | Good Morning Britain,53K views,Good Morning Britain,2 days ago,8:26,https://www.youtube.com/watch?v=LIovPxislWk,613K,348,283
75,Trump Addresses The Nation On Coronavirus From Oval Office | NBC News (Live Stream Recording),1M views,NBC News,Streamed 3 days ago,17:25,https://www.youtube.com/watch?v=I09RkjLcFpU,2.02M,"6,620","2,725"
76,"Trump’s Coronavirus Address, Blooper Reel Included | The Daily Show",3.3M views,The Daily Show with Trevor Noah,2 days ago,9:23,https://www.youtube.com/watch?v=BWO6i8cH8SA,6.61M,"69,567","2,787"
77,Coronavirus Test Shortage Raises Alarm As Washington State Bans Mass Gatherings | NBC Nightly News,358K views,NBC News,3 days ago,14:20,https://www.youtube.com/watch?v=JLZjUz9ZTn0,2.02M,"2,336",181
78,Coronavirus: COVID-19 declared a global pandemic | Nine News Australia,175K views,Nine News Australia,3 days ago,5:17,https://www.youtube.com/watch?v=G0vd0LhL_gM,290K,"1,067",131
79,Tom Hanks And Wife Rita Wilson Say They Have Coronavirus | TODAY,153K views,TODAY,2 days ago,2:57,https://www.youtube.com/watch?v=rLuYn0XPkyk,1.79M,"1,611",107
80,Bill de Blasio - Confronting the Coronavirus Outbreak in New York City | The Daily Show,1M views,The Daily Show with Trevor Noah,3 days ago,15:28,https://www.youtube.com/watch?v=aM2DZjsgAlA,6.61M,"15,827","2,451"
81,NBA suspends season due to coronavirus | SportsCenter,600K views,ESPN,3 days ago,4:52,https://www.youtube.com/watch?v=zNWBz4GCiUo,6.79M,"6,683",238
82,"Coronavirus around the world: March 12, 2020",340K views,Global News,2 days ago,3:26,https://www.youtube.com/watch?v=cAJppuDz-Mg,1.25M,"1,639",139
83,W.H.O declares coronavirus 'pandemic' - as UK sees highest daily rise in cases,816K views,Channel 4 News,3 days ago,13:55,https://www.youtube.com/watch?v=vFaC8hKovlQ,1.17M,"6,232",737
84,"ABC News Prime: Coronavirus, Italy Lockdown, Iraq",235K views,ABC News,Streamed 2 days ago,1:01:31,https://www.youtube.com/watch?v=NF7owuYjnWA,7.93M,"1,331",227
85,Italy Under Lockdown As Coronavirus Death Toll Jumps Dramatically | TODAY,474K views,TODAY,2 days ago,1:58,https://www.youtube.com/watch?v=AqAImF_mJtY,1.79M,"1,888",153
86,Coronavirus: What is a pandemic and why use the term now?  - BBC News,389K views,BBC News,2 days ago,7:45,https://www.youtube.com/watch?v=mmSJQul260g,6.6M,"3,195",209
87,Coronavirus: Should the UK quarantine like Italy? - BBC,496K views,BBC,3 days ago,7:00,https://www.youtube.com/watch?v=_zlwWDS-DCs,8.17M,"4,206",417
88,Tom Hanks and Rita Wilson test positive for coronavirus,554K views,CNN,3 days ago,8:49,https://www.youtube.com/watch?v=Wbk8ZrfU3EM,8.77M,"5,469","1,125"
89,Anthony Fauci says novel coronavirus '10 times deadlier than the flu',559K views,ABC News,3 days ago,4:16,https://www.youtube.com/watch?v=dM74KiaksgM,7.93M,"4,014",498
90,First Take reacts to Donovan Mitchell testing positive for coronavirus,2.3M views,ESPN,2 days ago,5:31,https://www.youtube.com/watch?v=33A8lbmSdPY,6.79M,"25,973","1,830"
91,We Need Leadership During Coronavirus - Between the Scenes | The Daily Show,876K views,The Daily Show with Trevor Noah,1 day ago,2:20,https://www.youtube.com/watch?v=NKMy4CSC6dg,6.61M,"26,073",387
92,BREAKING: NBA suspends season after Rudy Gobert tests positive for coronavirus | CBS Sports HQ,439K views,CBS Sports,3 days ago,8:04,https://www.youtube.com/watch?v=WfOuA-Rq_4Y,242K,"3,200",208
93,Doctor from Trump’s task force details latest on coronavirus l GMA,65K views,Good Morning America,1 day ago,6:36,https://www.youtube.com/watch?v=1aMIRdMyxaE,1.5M,514,51
94,"Coronavirus: L.A. County, city officials announce measures, health guidelines amid virus spread",48K views,KTLA 5,Streamed 2 days ago,48:20,https://www.youtube.com/watch?v=ld-8FwyY5BA,161K,225,44
95,Coronavirus Spread Threatens To Overwhelm US Hospital Capacity | Rachel Maddow | MSNBC,156K views,MSNBC,2 days ago,4:28,https://www.youtube.com/watch?v=KCOMwE92kHQ,2.45M,"1,586",92
96,Chris Hayes On How The U.S. Is On Italy's Coronavirus Trajectory | All In | MSNBC,337K views,MSNBC,3 days ago,6:34,https://www.youtube.com/watch?v=_-VxuZmEhV0,2.45M,"4,678",259
97,Trump Contradicts Experts as Coronavirus Is Declared a Pandemic: A Closer Look,2.5M views,Late Night with Seth Meyers,3 days ago,15:44,https://www.youtube.com/watch?v=7rMEA6KN_RU,3.5M,"37,657","1,862"
98,Trading Halted After Stocks Plunge Following Trump's Coronavirus Response | Velshi & Ruhle | MSNBC,162K views,MSNBC,2 days ago,4:43,https://www.youtube.com/watch?v=3gqTi3wfuqM,2.45M,"1,588",97
99,Trump to declare National Emergency amid coronavirus pandemic,781K views,Fox News,1 day ago,3:19,https://www.youtube.com/watch?v=ob5_NvJz1io,4.49M,"7,158",870
100,"Coronavirus: Virologist, Doctor and Intensive Care Consultant Discuss Latest | This Morning",216K views,This Morning,2 days ago,14:37,https://www.youtube.com/watch?v=hiXFeFMiAJc,1.67M,"1,619",198
101,Conan Shares Coronavirus Tips With His Staff - CONAN on TBS,2.7M views,Team Coco,4 days ago,6:56,https://www.youtube.com/watch?v=JJIsmDhzoD0,7.76M,"73,149","3,332"
102,Tracing The Origin Of The Coronavirus | NBC News NOW,378K views,NBC News,3 days ago,5:28,https://www.youtube.com/watch?v=mNB8zN5CQGc,2.02M,"4,049",429
103,Trump: Coronavirus is a world problem and we need separation,389K views,Fox News,2 days ago,25:34,https://www.youtube.com/watch?v=O8qC6YLsg7g,4.49M,"7,257",424
104,Treasury likely to push back tax deadline due to coronavirus,222K views,CBS News,3 days ago,3:05,https://www.youtube.com/watch?v=0d0AziuNgi8,2.4M,"1,111",241
105,Mark Cuban on coronavirus: This is much bigger than basketball | NBA on ESPN,424K views,ESPN,3 days ago,6:23,https://www.youtube.com/watch?v=vUB5DST4z-E,6.79M,"5,123",147
106,Coronavirus outbreak: Donald Trump suspends travel from Europe to U.S. starting Friday,331K views,Global News,Streamed 3 days ago,9:40,https://www.youtube.com/watch?v=X7KCyRxOoJw,1.25M,"3,701",744
107,"MLB expected to suspend operations in response to spread of coronavirus, reports say | CBS Sports HQ",25K views,CBS Sports,2 days ago,8:23,https://www.youtube.com/watch?v=7--SN2tWkTU,242K,143,29
108,Watch live: World Health Organization gives coronavirus update,128K views,CBS News,Streamed 3 days ago,33:33,https://www.youtube.com/watch?v=oQWRNrV3L-w,2.4M,731,124
109,WATCH LIVE: Trump addresses the nation amid coronavirus pandemic,340K views,PBS NewsHour,Streamed 3 days ago,57:32,https://www.youtube.com/watch?v=q3a8lEbj7f8,1.68M,"1,792",559
110,Novel Coronavirus explained l ABC News,455K views,ABC News,4 days ago,2:46,https://www.youtube.com/watch?v=CXOsVXybVJY,7.93M,"2,894",363
111,Porter Presses CDC Director To Confirm Coronavirus Testing Will Be Free | NBC News,208K views,NBC News,2 days ago,3:04,https://www.youtube.com/watch?v=mKvCAR0Akro,2.02M,"4,287",129
112,What is the level of concern with coronavirus around the NBA? | Get Up,174K views,ESPN,2 days ago,7:09,https://www.youtube.com/watch?v=3Jpwq7SpQxI,6.79M,"1,323",57
113,What Is Coronavirus (COVID-19)?,624K views,Johns Hopkins Medicine,3 weeks ago,4:31,https://www.youtube.com/watch?v=sHP0UIdZyI4,157K,"3,938",377
114,"Coronavirus Epidemic Update 33: COVID-19 Medication Treatment Trials, Global Testing Remains Limited",419K views,MedCram - Medical Lectures Explained CLEARLY,5 days ago,8:10,https://www.youtube.com/watch?v=Mm7UrZeu-74,602K,"8,910",199
115,Coronavirus: Is the UK on the same path as Italy?,391K views,Sky News,4 days ago,2:20,https://www.youtube.com/watch?v=fzbkY9s4Y6s,1.89M,"2,814",225
116,Coronavirus: Virus cases rise rapidly in Europe and US - BBC News,1.2M views,BBC News,3 days ago,8:30,https://www.youtube.com/watch?v=DoHOYCbmJoE,6.6M,"8,645",748
117,"Coronavirus Fears Cause Lines, Product Shortages At Costco",65K views,CBS Los Angeles,2 days ago,2:39,https://www.youtube.com/watch?v=UrniPVY8t5c,420K,395,39
118,Coronavirus outbreak: U.S. House Homeland Subcommittee hearing on federal response | FULL,140K views,Global News,Streamed 3 days ago,2:34:38,https://www.youtube.com/watch?v=HcPAfj38gk4,1.25M,"1,006",236
119,Biden Lays Out His Plan For Coronavirus  | NBC News NOW,37K views,NBC News,2 days ago,10:56,https://www.youtube.com/watch?v=mhp-px3tv6E,2.02M,178,361
120,Coronavirus Disrupts Daily Life As Trump Fails To Calm A Nation On Edge | The 11th Hour | MSNBC,386K views,MSNBC,1 day ago,6:20,https://www.youtube.com/watch?v=i0K4PIVe92I,2.45M,"4,241",430
121,"WATCH LIVE: NIH, CDC testify before House committee on coronavirus response (day two)",83K views,Washington Post,Streamed 2 days ago,1:50:31,https://www.youtube.com/watch?v=R0jm6sKX-dY,1M,656,91
122,Watch again: Boris Johnson makes coronavirus announcement after COBRA meeting,492K views,The Telegraph,Streamed 2 days ago,45:51,https://www.youtube.com/watch?v=A0chs7bVQ8Y,943K,"3,529","2,065"
123,"COVID-19 (Coronavirus Disease 19) - causes, symptoms, diagnosis, treatment, pathology",1.4M views,Osmosis,1 month ago,12:21,https://www.youtube.com/watch?v=eup3_i_5uaw,1.42M,"22,619",698
124,"Trump Hasn't Been Tested For Coronavirus Despite Possible Exposure, And Refuses To Take Precautio…",2.3M views,The Late Show with Stephen Colbert,4 days ago,12:10,https://www.youtube.com/watch?v=YgkNuoozmis,7.26M,"33,959","1,359"
125,Coronavirus Explained: What does pandemic declaration mean for the world?,167K views,Channel 4 News,3 days ago,6:44,https://www.youtube.com/watch?v=XJV3X8zM1bU,1.17M,"1,726",153
126,Coronavirus outbreak: How many people can possibly get COVID-19?,76K views,Global News,3 days ago,2:46,https://www.youtube.com/watch?v=J-Z8f0xoirc,1.25M,664,48
127,CA Gov. Newsom provides updates on coronavirus,54K views,KTLA 5,Streamed 2 days ago,1:07:45,https://www.youtube.com/watch?v=MBRmQB5bPZI,161K,325,76
128,World Health Organization declares coronavirus a pandemic | ABC News,200K views,ABC News,3 days ago,2:47,https://www.youtube.com/watch?v=9mT0zFR9us8,7.93M,"1,923",274
129,Coronavirus: Italy in lockdown - BBC News,1M views,BBC News,4 days ago,18:20,https://www.youtube.com/watch?v=_69sOxWU0jo,6.6M,"6,987",496
130,"Coronavirus outbreak: We are not nearly as prepared as we need to be, officials say",18K views,Global News,1 day ago,12:08,https://www.youtube.com/watch?v=PUp2vZ_3wgY,1.25M,208,62
131,"Global National: March 10, 2020 | Coronavirus cases surging globally, is Canada ready for worse?",57K views,Global News,4 days ago,22:16,https://www.youtube.com/watch?v=O7B_mwZyH2Y,1.25M,596,46
132,What China's Pollution Says About Coronavirus and the Economy | WSJ,450K views,Wall Street Journal,3 days ago,4:31,https://www.youtube.com/watch?v=cHSftdHskxs,2.03M,"7,431",306
133,Coronavirus containment zone implemented in New York,85K views,CBS This Morning,3 days ago,2:20,https://www.youtube.com/watch?v=iULdVyQ6Bys,1.24M,403,36
134,Novel coronavirus (2019-nCoV),2.7M views,World Health Organization (WHO),1 month ago,4:49,https://www.youtube.com/watch?v=mOV1aBVYKGA,209K,"12,905",689
135,The Jazz are waiting for coronavirus test results before they can leave OKC | Get Up,106K views,ESPN,2 days ago,6:07,https://www.youtube.com/watch?v=OR74I-NKvpQ,6.79M,"1,101",26
136,Coronavirus: Inside Italy After Country Put On Nationwide Lockdown | NBC Nightly News,260K views,NBC News,4 days ago,1:39,https://www.youtube.com/watch?v=Jt2pZWOmi80,2.02M,"1,112",219
137,"Global National: March 11, 2020 | WHO declares coronavirus a global pandemic",229K views,Global News,3 days ago,22:15,https://www.youtube.com/watch?v=XcARC2mrmcQ,1.25M,"1,107",122
138,The 5 Stages of Coronavirus,2M views,Jimmy Kimmel Live,2 days ago,11:37,https://www.youtube.com/watch?v=mD97kJVCOXM,16.4M,"32,063","1,907"
139,Coronavirus: Cruise ship Grand Princess docks in California - BBC News,318K views,BBC News,3 days ago,17:40,https://www.youtube.com/watch?v=7S-1QRRWj10,6.6M,"2,139",307
140,Merkel: Most people in Germany likely to contract Coronavirus | DW News,298K views,DW News,3 days ago,15:42,https://www.youtube.com/watch?v=6CGi41nB3tA,1.08M,"3,092",226
141,Experts Hope Herd Immunity ‘Flattens’ The Coronavirus Curve | NBC News NOW,262K views,NBC News,3 days ago,15:15,https://www.youtube.com/watch?v=f2aDEPZbLEI,2.02M,"1,997",244
142,Infectious Disease Expert: Half Of America Is Likely To Catch Coronavirus | The 11th Hour | MSNBC,419K views,MSNBC,2 days ago,3:20,https://www.youtube.com/watch?v=7ajACc7ul4k,2.45M,"2,501",432
143,U.S. Unprepared For Expected Explosion In Coronavirus Cases | Rachel Maddow | MSNBC,411K views,MSNBC,2 days ago,8:06,https://www.youtube.com/watch?v=xOQt5u1RsCg,2.45M,"6,118",459
144,PM Justin Trudeau's wife tests positive for coronavirus: Report,497K views,Fox News,2 days ago,0:23,https://www.youtube.com/watch?v=a1vKEIzvE08,4.49M,"4,482",722
