,title,view,channel,uploadtime,length,link,subscriber,like,dislike
0,Unprecedented restrictions in Italy over coronavirus outbreak,22K views,CNN,3 hours ago,8:18,https://www.youtube.com/watch?v=v_vDjR5zBDk,8.71M,735,124
1,New York reels with largest coronavirus outbreak in US | WNT,264K views,ABC News,11 hours ago,3:57,https://www.youtube.com/watch?v=7JedXOgOPC8,7.86M,"2,082",223
2,Trump urges calm at coronavirus task force briefing,442K views,CBS News,10 hours ago,5:51,https://www.youtube.com/watch?v=zSfbAP3emSE,2.39M,"2,610","2,208"
3,Governor Cuomo Gives Updates On Coronavirus In New York | Katy Tur | MSNBC,98K views,MSNBC,14 hours ago,5:36,https://www.youtube.com/watch?v=06Q1CQd33zM,2.42M,711,253
4,Coronavirus: Cruise Ship Carrying People With Coronavirus Docks In California | NBC Nightly News,209K views,NBC News,10 hours ago,13:34,https://www.youtube.com/watch?v=sku3zWvLXnM,1.96M,919,101
5,Growing Fears Over Response To Coronavirus As Number Of Confirmed Cases Soar | NBC Nightly News,1.3M views,NBC News,1 day ago,11:09,https://www.youtube.com/watch?v=GLsXcv5zouQ,1.96M,"10,797","1,975"
6,Fast moving developments in the coronavirus outbreak,605K views,ABC News,1 day ago,4:45,https://www.youtube.com/watch?v=ya3Pqasvyno,7.86M,"5,563",839
7,CNN polled Americans about coronavirus. Here's what they said,364K views,CNN,14 hours ago,3:27,https://www.youtube.com/watch?v=4Vsjtvm4cyA,8.71M,"3,357",678
8,Fmr. Obama Economist: Trump's Coronavirus Payroll Tax Cut Not The Answer | The Last Word | MSNBC,50K views,MSNBC,7 hours ago,4:41,https://www.youtube.com/watch?v=AvLWF12Lpbs,2.42M,921,130
9,California Governor Gavin Newsom gives update on coronavirus outbreak,122K views,CBS News,1 day ago,41:59:00,https://www.youtube.com/watch?v=uW3aTBcK3go,2.39M,"1,095",214
10,Coronavirus: Answering 4 of the most 'Googled' questions | USA TODAY,185K views,USA TODAY,21 hours ago,3:12,https://www.youtube.com/watch?v=jK5NVWfFBO8,1.36M,"1,267",341
11,Ted Cruz will self-quarantine after interacting with individual with coronavirus at CPAC,1.1M views,CNN,1 day ago,6:32,https://www.youtube.com/watch?v=PbvVGko2LmI,8.71M,"8,861","1,956"
12,Coronavirus lockdown in Italy as 16 million people quarantined,507K views,Channel 4 News,1 day ago,7:35,https://www.youtube.com/watch?v=jQsKe2n3bk4,1.13M,"3,538",272
13,"Coronavirus outbreak: Oregon governor, health officials to give update on COVID-19 response",106K views,Global News,Streamed 1 day ago,17:28,https://www.youtube.com/watch?v=ZSbfh5Ny4ww,1.21M,887,146
14,Journalist goes undercover at wet markets where the Coronavirus started | 60 Minutes Australia,1.3M views,60 Minutes Australia,1 day ago,27:31:00,https://www.youtube.com/watch?v=Y7nZ4mw4mXw,1.61M,"15,318","2,190"
15,Coronavirus: Italy puts millions under quarantine | DW News,545K views,DW News,1 day ago,9:31,https://www.youtube.com/watch?v=ii84tOLbrN4,1.06M,"4,424",324
16,"CDC, White House send conflicting messages on coronavirus",56K views,Washington Post,1 day ago,3:49,https://www.youtube.com/watch?v=p7Neyh65Qe8,992K,419,167
17,Watch live: New York City Mayor de Blasio gives coronavirus update,189K views,NBC News,Streamed 1 day ago,1:31:44,https://www.youtube.com/watch?v=_3Mn-mJdHUo,1.96M,"1,493",485
18,Coronavirus death toll rises in Italy to 366 as quarter of population on lockdown | ITV News,615K views,ITV News,1 day ago,2:09,https://www.youtube.com/watch?v=t62aK_9Ptmg,433K,"2,452",310
19,Washington Planning Ahead For Expected Coronavirus Surge | Rachel Maddow | MSNBC,8.4K views,MSNBC,3 hours ago,4:29,https://www.youtube.com/watch?v=S0Z79LzNpdU,2.42M,525,47
20,Testing Flaws And Capacity Issues Slow U.S. Response To Coronavirus Spread | Meet The Press,35K views,NBC News,1 day ago,3:14,https://www.youtube.com/watch?v=V4ZuNqTqm1w,1.96M,325,54
21,Major lockdown in Italy from coronavirus,257K views,ABC News,1 day ago,2:00,https://www.youtube.com/watch?v=TlP6Tlj04T4,7.86M,"1,883",201
22,"Coronavirus Threat: To The Economy, And The Presidency | The Day That Was | MSNBC",264K views,MSNBC,1 day ago,5:55,https://www.youtube.com/watch?v=FdNJsy231Cs,2.42M,"3,021",215
23,State of Emergency in New York with at least 76 coronavirus cases,467K views,ABC News,2 days ago,2:52,https://www.youtube.com/watch?v=b7aX6-NkWaM,7.86M,"3,449",582
24,Doctor Answers Commonly Googled Questions About Coronavirus,358K views,BuzzFeedVideo,1 day ago,8:13,https://www.youtube.com/watch?v=hHEBCk0SQA8,20M,"12,421",407
25,Gov. Cuomo Updates on Coronavirus in NY,37K views,NBC New York,Streamed 1 day ago,28:11:00,https://www.youtube.com/watch?v=wmNI0atk-7Y,108K,292,79
26,Coronavirus disease cases in Philippines rise to 33,3.1K views,ABS-CBN News,Streamed 2 hours ago,34:26:00,https://www.youtube.com/watch?v=S5w-UO6pSSU,8.48M,440,36
27,First UK Coronavirus death in Berkshire - BBC NEWS,202K views,BBC News,4 days ago,8:56,https://www.youtube.com/watch?v=qWoL8MsrwpU,6.53M,"1,557",130
28,SE Cupp: This is why we're panicked about coronavirus,473K views,CNN,2 days ago,7:55,https://www.youtube.com/watch?v=s_ypH6Bk-oY,8.71M,"5,695","2,853"
29,"Dr. Fauci sets the record straight on coronavirus testing, prevention",211K views,Fox News,1 day ago,10:00,https://www.youtube.com/watch?v=xvW17dSuX5Q,4.44M,"3,797",466
30,All of Italy is now on lockdown due to coronavirus,817K views,CNN,13 hours ago,8:36,https://www.youtube.com/watch?v=lm7Xi3cw6dY,8.71M,"6,938","1,239"
31,Cuomo Declares State Of Emergency In New York For Coronavirus Outbreak | NBC News,24K views,NBC News,2 days ago,2:09,https://www.youtube.com/watch?v=yQW3ExxiaEI,1.96M,302,25
32,Watch live: D.C. mayor updates on coronavirus after first positive case,280K views,NBC News,Streamed 2 days ago,1:00:04,https://www.youtube.com/watch?v=Ebf0tY84j8U,1.96M,"1,204",304
33,Italy's north under travel lockdown to curb coronavirus spread,102K views,CBC News,1 day ago,6:54,https://www.youtube.com/watch?v=2KP2QC5s7QQ,1.85M,804,86
34,Coronavirus threatens to have broad economic impact,163K views,CBS News,2 days ago,7:17,https://www.youtube.com/watch?v=btSf0cvgJys,2.39M,"1,368",134
35,Is Italy’s Massive Coronavirus Quarantine Sign Of Things To Come? | AM Joy | MSNBC,59K views,MSNBC,1 day ago,3:00,https://www.youtube.com/watch?v=8jJJ1TtUQMM,2.42M,"1,377",117
36,Coronavirus: Milan set for lockdown,507K views,Sky News,2 days ago,3:11,https://www.youtube.com/watch?v=Zh3YBVjDXfY,1.86M,"3,241",194
37,Italy's coronavirus outbreak sparks 'a lot of panic,27K views,PBS NewsHour,1 day ago,5:30,https://www.youtube.com/watch?v=e4fJ_F0urwk,1.67M,315,24
38,Full Hogan: 'This Thing Is Escalating So Rapidly' As Coronavirus Spreads | Meet The Press | NBC News,86K views,NBC News,1 day ago,5:12,https://www.youtube.com/watch?v=y0Ge96Q3xR4,1.96M,725,175
39,"At least 234 people have been diagnosed with coronavirus in US, according to CDC | ABC News",751K views,ABC News,2 days ago,4:21,https://www.youtube.com/watch?v=jK7NJEvw7Wc,7.86M,"5,480",564
40,"At least 12 dead, 188 infected in US as coronavirus continues to spread | Nightline",1.4M views,ABC News,3 days ago,8:02,https://www.youtube.com/watch?v=7hB13abLQkE,7.86M,"13,026","1,806"
41,China hotel collapses with quarantined coronavirus patients inside,740K views,ABC News,2 days ago,1:47,https://www.youtube.com/watch?v=0vbplrxtqKE,7.86M,"4,303",664
42,Who will save the world from a coronavirus recession? | Counting the Cost,184K views,Al Jazeera English,1 day ago,25:41:00,https://www.youtube.com/watch?v=OOXf4ni7K7E,4.69M,"1,014",88
43,Italy plans large-scale quarantine in response to coronavirus outbreak,918K views,Fox News,2 days ago,2:31,https://www.youtube.com/watch?v=6iQV02gi7fE,4.44M,"6,007",854
44,21 people aboard Grand Princess cruise ship test positive for coronavirus: Pence | ABC News,71K views,ABC News,3 days ago,1:09,https://www.youtube.com/watch?v=NSAHO-XcJew,7.86M,490,102
45,Doctor shares CDC's latest coronavirus warnings,525K views,CBS This Morning,2 days ago,4:40,https://www.youtube.com/watch?v=0WeSAuoYsOQ,1.23M,"5,693",466
46,A second person in the UK has died from coronavirus,298K views,Sky News,3 days ago,1:56,https://www.youtube.com/watch?v=D3UJwzhXtKM,1.86M,"2,204",281
47,First Coronavirus death in the UK as California declares state emergency,293K views,Channel 4 News,4 days ago,15:24,https://www.youtube.com/watch?v=jeT75kZiHH4,1.13M,"1,984",159
48,Worried about the coronavirus? See this patient's advice,746K views,CNN,2 days ago,5:08,https://www.youtube.com/watch?v=_O0IbLsZ3wA,8.71M,"5,407",940
49,Italy quarantines 16 million over coronavirus,138K views,Al Jazeera English,2 days ago,2:14,https://www.youtube.com/watch?v=gRrjLwzyTLs,4.69M,"1,032",53
50,"ABC News Prime: Coronavirus global spread, Grand Princess cruise ship, Market meltdown",90K views,ABC News,Streamed 11 hours ago,1:25:06,https://www.youtube.com/watch?v=N_mu7TRI9TU,7.86M,"1,193",329
51,Trump Admin Bungling Overshadows Crucial Coronavirus Advice: AP | Rachel Maddow | MSNBC,16K views,MSNBC,3 hours ago,2:57,https://www.youtube.com/watch?v=p7ut_TQ33Rg,2.42M,"1,085","1,078"
52,Corona Virus के बारे में जनता की जानकारी | Q&A | Coronavirus Disease | COVID 19 | Precautions | WHO,127K views,The Lallantop,3 days ago,4:37,https://www.youtube.com/watch?v=DoMTUTuDtGE,12M,"1,589",239
53,The Ingraham Angle Coronavirus Cold Open - SNL,4.3M views,Saturday Night Live,2 days ago,9:21,https://www.youtube.com/watch?v=XezLiezWN0E,9.91M,"50,028","4,141"
54,"Coronavirus: Second British death and more than 100,000 cases worldwide - BBC News",515K views,BBC News,3 days ago,16:17,https://www.youtube.com/watch?v=nETgZwRuJPU,6.53M,"4,234",324
55,New Cases Of Coronavirus Across U.S. Causes Criticism Of Trump's Response To Grow | NBC Nightly News,681K views,NBC News,3 days ago,16:03,https://www.youtube.com/watch?v=ODNtD86cRso,1.96M,"4,778",644
56,CORONAVIRUS PANDEMIC EXPLAINED - CORONA OUTBREAK 2020,342K views,MEDSimplified,4 days ago,10:07,https://www.youtube.com/watch?v=sWjYs7aILZ8,269K,"5,266",321
57,Briton who contracted coronavirus in Wuhan explains symptoms,202K views,Guardian News,3 days ago,1:50,https://www.youtube.com/watch?v=PU2ut5Ark3Q,842K,"1,342",165
58,Trump Praises Coronavirus Response As Cases Rack Up And Markets Spiral | The 11th Hour | MSNBC,199K views,MSNBC,3 days ago,5:01,https://www.youtube.com/watch?v=2cBZ77m9dHs,2.42M,"2,272",199
59,Coronavirus Task Force Gives Update On COVID-19 | NBC News (Live Stream),235K views,NBC News,Streamed 3 days ago,35:11:00,https://www.youtube.com/watch?v=-kE8yd61MJU,1.96M,"1,318",640
60,PM reacts to UK's first coronavirus-related death,652K views,Sky News,4 days ago,2:35,https://www.youtube.com/watch?v=AtfGK1eImRo,1.86M,"4,723",799
61,Watch live: Gov. Cuomo holds coronavirus press briefing,136K views,NBC News,Streamed 2 days ago,44:49:00,https://www.youtube.com/watch?v=x-ioSQSkfec,1.96M,"1,085",206
62,Coronavirus crisis in US as more cases are reported l ABC News,640K views,ABC News,3 days ago,4:11,https://www.youtube.com/watch?v=Qow1al_afYQ,7.86M,"5,024",732
63,"Coronavirus coverage: Sunday, March 8 at 8 a.m.",34K views,KING 5,1 day ago,4:20,https://www.youtube.com/watch?v=fhwGca6ZT-w,80K,277,20
64,Coronavirus: Half of California cruise passengers test positive | Nine News Australia,101K views,Nine News Australia,3 days ago,2:18,https://www.youtube.com/watch?v=BzGQ7pXJ998,280K,688,116
65,Coronavirus and pets: can my dog or cat spread the disease?,30K views,Guardian News,3 days ago,3:10,https://www.youtube.com/watch?v=V4jw47bKQfw,842K,176,24
66,Former FDA chief warns of economic impact of coronavirus outbreak,47K views,Face the Nation,1 day ago,6:15,https://www.youtube.com/watch?v=VA-LqgKMD2E,127K,482,31
67,Coronavirus expert: 'War is an appropriate analogy',1.6M views,Channel 4 News,3 days ago,19:53,https://www.youtube.com/watch?v=dcJDpV-igjs,1.13M,"21,299","1,303"
68,Judge Jeanine: Media hit the panic button over coronavirus,243K views,Fox News,1 day ago,9:06,https://www.youtube.com/watch?v=JNeYRwChLfE,4.44M,"8,929",958
69,Iran MP dies from coronavirus as total toll spikes,206K views,Al Jazeera English,2 days ago,3:09,https://www.youtube.com/watch?v=C7aAs28KPEE,4.69M,"1,607",96
70,How US communities are reacting to coronavirus,273K views,ABC News,3 days ago,5:42,https://www.youtube.com/watch?v=BiGWVklFFDw,7.86M,"2,306",397
71,"With the coronavirus, 'pay attention to the basics'",47K views,PBS NewsHour,1 day ago,14:05,https://www.youtube.com/watch?v=1BSwS9Rmhys,1.67M,609,38
72,"COVID-19 (Coronavirus Disease 19) - causes, symptoms, diagnosis, treatment, pathology",791K views,Osmosis,3 weeks ago,12:21,https://www.youtube.com/watch?v=eup3_i_5uaw,1.41M,"13,899",409
73,Neil deGrasse Tyson On Coronavirus: Will People Listen To Science?,2.3M views,The Late Show with Stephen Colbert,3 days ago,10:55,https://www.youtube.com/watch?v=jB4FUHHMI24,7.24M,"46,406","2,203"
74,What Is Coronavirus (COVID-19)?,397K views,Johns Hopkins Medicine,2 weeks ago,4:31,https://www.youtube.com/watch?v=sHP0UIdZyI4,155K,"2,685",268
75,Bernie Sanders talks coronavirus on the campaign trail,344K views,CNN,1 day ago,10:18,https://www.youtube.com/watch?v=UxiJ_bqD2Ds,8.71M,"5,980",509
76,Italy scrambles to contain coronavirus outbreak,88K views,CBS News,3 days ago,7:26,https://www.youtube.com/watch?v=XZVj8dEq5UA,2.39M,436,61
77,Chris Hayes: Trump Is Trying To BS His Way Through The Coronavirus Outbreak | All In | MSNBC,980K views,MSNBC,3 days ago,11:16,https://www.youtube.com/watch?v=Ow5bhEi6EdY,2.42M,"18,880","2,185"
78,Coronavirus outbreak claims lives of more than a dozen Life Care Center residents,76K views,KING 5,Streamed 2 days ago,23:42,https://www.youtube.com/watch?v=YcT9EQTj4qA,80K,902,71
79,Novel coronavirus (2019-nCoV),2M views,World Health Organization (WHO),1 month ago,4:49,https://www.youtube.com/watch?v=mOV1aBVYKGA,181K,"9,813",575
80,Coronavirus: How afraid should we be? | Question Time - BBC,151K views,BBC,3 days ago,29:35:00,https://www.youtube.com/watch?v=dCZaeLDDeBo,8.15M,"1,370",295
81,Trump Keeps Lying About the Coronavirus Outbreak: A Closer Look,2.3M views,Late Night with Seth Meyers,4 days ago,9:22,https://www.youtube.com/watch?v=JiqFnKXf3do,3.48M,"36,847","1,818"
82,Coronavirus: Countries need to 'help each other' as deaths increase - BBC Newsnight,47K views,BBC Newsnight,4 days ago,7:50,https://www.youtube.com/watch?v=yNxAmRAYagQ,519K,459,106
83,Coronavirus cruise ship quarantined off California coast,201K views,CBS This Morning,4 days ago,3:07,https://www.youtube.com/watch?v=Oi__oRijPnM,1.23M,"1,524",169
84,Coronavirus: Cruise Ship Held Off California Coast After Passenger Dies | TODAY,233K views,TODAY,4 days ago,5:07,https://www.youtube.com/watch?v=Cz0bTuYT93Y,1.77M,"1,638",108
85,"Coronavirus coverage: Saturday, March 7 at 5:00 p.m.",38K views,KING 5,2 days ago,8:08,https://www.youtube.com/watch?v=0DT0ckKmQSM,80K,303,19
86,Steve Wozniak talks to Sanjay Gupta about coronavirus scare,253K views,CNN,3 days ago,7:52,https://www.youtube.com/watch?v=edxkrkKSVXU,8.71M,"2,140",331
87,Doctor Fact-Checks Media On Coronavirus,1.9M views,Doctor Mike,1 day ago,9:37,https://www.youtube.com/watch?v=5CRxyHU9Oxo,5.2M,"136,466","1,782"
88,Coronavirus Patient Explains The Worst Symptoms | NBC News,869K views,NBC News,4 days ago,3:18,https://www.youtube.com/watch?v=NLGX2L9JLa8,1.96M,"7,986",441
89,"Coronavirus Symptoms, Diagnosis, Treatment, & Vaccine Status",1M views,MedCram - Medical Lectures Explained CLEARLY,1 month ago,4:33,https://www.youtube.com/watch?v=UCG3xqtcL3c,572K,"10,747",451
90,Johns Hopkins Experts Brief Capitol Hill on Coronavirus (COVID-19),161K views,Johns Hopkins University,Streamed 3 days ago,1:29:08,https://www.youtube.com/watch?v=Pnk8DuAly9Y,20.8K,"1,654",169
91,The fallout from the new coronavirus now spreading coast to coast | WNT,463K views,ABC News,3 days ago,3:28,https://www.youtube.com/watch?v=xoXjJd2Ae18,7.86M,"4,667",268
92,Trump Is Not Telling The Truth About The Coronavirus | The 11th Hour | MSNBC,331K views,MSNBC,4 days ago,5:37,https://www.youtube.com/watch?v=HbVjOmDAILg,2.42M,"2,810","2,254"
93,How to stop the spread of coronavirus,257K views,Guardian News,5 days ago,4:31,https://www.youtube.com/watch?v=3jpXAMwRSu4,842K,"1,271",85
94,"Asian Americans see racism, discrimination amid coronavirus panic",165K views,CBS This Morning,3 days ago,4:32,https://www.youtube.com/watch?v=Vc7y7TQe_Dg,1.23M,"3,065",305
95,Scaramucci takes 'defensive position' as coronavirus outbreak affects economy,244K views,CNN,5 days ago,10:11,https://www.youtube.com/watch?v=wQrGiDQXbrk,8.71M,"2,331",340
96,"Coronavirus cases surpass 100,000 worldwide",41K views,CBS Evening News,3 days ago,3:43,https://www.youtube.com/watch?v=z9wKnkEpnCU,692K,255,22
97,Coronavirus: doctors and nurses in Iran filmed dancing in bid to boost morale,146K views,Guardian News,5 days ago,0:45,https://www.youtube.com/watch?v=wamoQYVI0ww,842K,"1,104",133
98,Coronavirus: China combats ever-strengthening disease,2.6M views,The Telegraph,1 month ago,1:44,https://www.youtube.com/watch?v=P6t3SxhvRuE,927K,"10,032",877
99,The Virus: An in-depth look at the coronavirus crisis | ABC News,103K views,ABC News (Australia),3 days ago,15:16,https://www.youtube.com/watch?v=qgfbfEbsp3I,922K,568,119
100,"213 dead, 9,692 cases of coronavirus confirmed in China",1.5M views,ARIRANG NEWS,1 month ago,3:03,https://www.youtube.com/watch?v=0YOVPIQuvAw,276K,"8,963",552
101,"Global National: March 5, 2020 | Coronavirus cases continue to rise in Canada and around the world",236K views,Global News,4 days ago,21:12,https://www.youtube.com/watch?v=ueA2d_TjTVU,1.21M,"1,249",153
102,Coronavirus outbreak: Canadian WHO doctor returns from China with critical COVID-19 lessons,340K views,Global News,4 days ago,11:47,https://www.youtube.com/watch?v=XUI6DIswmFk,1.21M,"3,710",389
103,Coronavirus: Inside the lab trying to fight Covid-19 - BBC Newsnight,12K views,BBC Newsnight,3 days ago,5:06,https://www.youtube.com/watch?v=IQkxHovgHYk,519K,115,9
104,Coronavirus Explained: What happens next? - BBC News,374K views,BBC News,4 days ago,9:59,https://www.youtube.com/watch?v=Mj81jKkQMOg,6.53M,"3,677","1,099"
105,Coronavirus in Hindi | Coronavirus Latest Update | Coronavirus Symptoms in Humans | Corona-Virus,685K views,Magnet Brains,1 week ago,16:31,https://www.youtube.com/watch?v=ECXJoqSvIys,132K,"14,075",901
106,Coronavirus: what we know so far about the outbreak spreading in China and abroad,2.6M views,South China Morning Post,1 month ago,5:27,https://www.youtube.com/watch?v=Zru5REL9ANg,920K,"15,875","1,205"
107,"ABC News Prime: Coronavirus global spread, White House response, Women's History Month",95K views,ABC News,Streamed 3 days ago,1:00:46,https://www.youtube.com/watch?v=Kh1_rS8Dodw,7.86M,996,153
108,Can we stop the panic over Coronavirus? | Inside Story,217K views,Al Jazeera English,2 days ago,24:56:00,https://www.youtube.com/watch?v=Km9jHPuHGfc,4.69M,"1,808",300
109,Our Doctors Answer Your Coronavirus Questions | This Morning,106K views,This Morning,3 days ago,10:46,https://www.youtube.com/watch?v=4-Ce9Q1CtGE,1.66M,"1,130",105
110,Q&A How to protect yourself when travelling during the coronavirus (COVID-2019) outbreak.,377K views,World Health Organization (WHO),3 weeks ago,22:45,https://www.youtube.com/watch?v=0KBvReECRrI,181K,881,286
111,Coronavirus: 55 people exposed to disease in Australia | Nine News Australia,682K views,Nine News Australia,5 days ago,9:02,https://www.youtube.com/watch?v=mHcwX2yiLkU,280K,"4,151",711
112,Britain hit by surge in coronavirus cases,999K views,Sky News,5 days ago,3:19,https://www.youtube.com/watch?v=4DdNwX9n7dw,1.86M,"5,906",527
113,Why It's Not A Time For Trump's Hunches On Coronavirus | Morning Joe | MSNBC,502K views,MSNBC,4 days ago,8:56,https://www.youtube.com/watch?v=JQjqxO7N08I,2.42M,"5,839",806
114,Coronavirus outbreak: Mother of sick daughter from virus-hit region pleads for help,3.8M views,Global News,1 month ago,3:44,https://www.youtube.com/watch?v=NytLE5ECa8M,1.21M,"27,580","1,772"
115,Coronavirus death toll climbs in US l ABC News,511K views,ABC News,5 days ago,2:46,https://www.youtube.com/watch?v=8uybFoGCzOo,7.86M,"4,361",593
116,State Of Emergency In Los Angeles County Over Coronavirus Outbreak | NBC Nightly News,2.1M views,NBC News,5 days ago,8:35,https://www.youtube.com/watch?v=FYpl_5cWWfU,1.96M,"15,585","2,042"
117,"Is the coronavirus outbreak in Wuhan, China under control? | ITV News",221K views,ITV News,5 days ago,2:14,https://www.youtube.com/watch?v=TY4El-CEHQs,433K,"1,072",200
118,Chris Hayes On Trump’s Failing Response To Coronavirus | All In | MSNBC,371K views,MSNBC,5 days ago,4:58,https://www.youtube.com/watch?v=hWc2A-BwKnM,2.42M,"8,868",437
119,"Coronavirus COVID-19 Symptoms, Causes, Prevention Nursing Review",205K views,RegisteredNurseRN,1 week ago,12:22,https://www.youtube.com/watch?v=ALRLihS19kQ,850K,,
120,Coronavirus in China: The fight against the outbreak,2M views,CBC News: The National,1 month ago,2:52,https://www.youtube.com/watch?v=V0qxJzv3ssc,660K,"7,087",726
121,क्या Chicken खाने से हो सकता है कोरोना वायरस? | Coronavirus China in Hindi | Coronavirus India News,1.1M views,Adda247,Streamed 3 weeks ago,13:52,https://www.youtube.com/watch?v=mjkjP51tznk,3.54M,"18,121","2,037"
122,Coronavirus: Death toll rises as virus spreads to every Chinese region - BBC News,3.6M views,BBC News,1 month ago,10:12,https://www.youtube.com/watch?v=6vHEJL-RVMk,6.53M,"28,047","1,961"
123,What Washington’s response to coronavirus tells us,157K views,CNN,4 days ago,6:08,https://www.youtube.com/watch?v=rljfwYO5zZg,8.71M,"1,401",841
124,Coronavirus: Italy to close all schools as deaths rise - BBC News,1.1M views,BBC News,5 days ago,12:13,https://www.youtube.com/watch?v=PGjeMDpIf8M,6.53M,"9,319",694
125,Spike in coronavirus cases and fatalities around the world,828K views,ABC News,1 week ago,3:46,https://www.youtube.com/watch?v=eVmQDR4vKRM,7.86M,"7,903",888
126,What happens to your body when you get coronavirus,1.1M views,The Telegraph,5 days ago,2:06,https://www.youtube.com/watch?v=2bI5pQGXl2o,927K,"11,282",649
127,"‘Please take my daughter’, pleads mother of cancer patient at coronavirus blockade in China",1.2M views,South China Morning Post,1 month ago,3:02,https://www.youtube.com/watch?v=hP6ycqZmYc4,920K,"14,018",544
128,Trump Doubts Coronavirus Science,1M views,Jimmy Kimmel Live,4 days ago,7:42,https://www.youtube.com/watch?v=IiUCja0a8kc,16.3M,"16,468","1,035"
129,How Coronavirus Kills: Acute Respiratory Distress Syndrome (ARDS) & Treatment,2.1M views,MedCram - Medical Lectures Explained CLEARLY,1 month ago,11:05,https://www.youtube.com/watch?v=okg7uq_HrhQ,572K,"35,980","1,074"
130,"Coronavirus: Can China contain outbreak that has infected 2,700 people?",1.4M views,Channel 4 News,1 month ago,11:08,https://www.youtube.com/watch?v=2rUyz8MXorU,1.13M,"9,873",698
131,Última hora El Tiempo: se confirma primer caso de coronavirus en Colombia,596K views,EL TIEMPO,Streamed 3 days ago,1:59:36,https://www.youtube.com/watch?v=E3mZZ-tr9AM,455K,"1,327",167
132,Coronavirus may have originated from Wuhan market,2.2M views,CBS News,1 month ago,6:58,https://www.youtube.com/watch?v=-JFC81JEoIw,2.39M,"8,793","1,346"
133,Coronavirus and warm weather: Explaining the potential impact of seasonality,96K views,Washington Post,6 days ago,3:21,https://www.youtube.com/watch?v=bLr09SVhqsQ,992K,715,114
134,"Coronavirus deaths in Italy at 79, China cases slow",230K views,Al Jazeera English,6 days ago,2:14,https://www.youtube.com/watch?v=XJU-4kQr_6o,4.69M,"1,097",92
135,The potential problems with stockpiling for coronavirus outbreak,64K views,CBC News: The National,5 days ago,1:58,https://www.youtube.com/watch?v=CiIwOo0nXAQ,660K,443,164
136,Sadhguru on Coronavirus Outbreak in China,2.1M views,Sadhguru,4 weeks ago,8:25,https://www.youtube.com/watch?v=mP-mCfo4-f8,4.43M,"48,335","2,840"
137,What is the coronavirus?,8.1M views,Guardian News,1 month ago,3:41,https://www.youtube.com/watch?v=aerq4byr7ps,842K,"168,391","3,958"
138,Coronavirus updates for Friday March 6 - noon,34K views,KING 5,3 days ago,6:48,https://www.youtube.com/watch?v=T-9vqfzYWE4,80K,221,16
139,Coronavirus Q&A: Expert answers your questions on Covid-19,245K views,Channel 4 News,5 days ago,24:04:00,https://www.youtube.com/watch?v=9plB00gdlkk,1.13M,"2,196",290
140,Coronavirus: Das wissen wir über Covid-19 | Quarks Extra,219K views,Quarks,2 days ago,17:21,https://www.youtube.com/watch?v=WReBrwIllao,350K,"4,835",316
141,Coronavirus: Is Britain Ready? | Documentary,994K views,Channel 4 News,3 weeks ago,24:54:00,https://www.youtube.com/watch?v=ZBOwFBu05c8,1.13M,"6,999",746
142,Trump says he will not stop campaign rallies over coronavirus,155K views,CBS This Morning,2 days ago,2:55,https://www.youtube.com/watch?v=t1PzqP-oolc,1.23M,"1,080",501
143,China Is Censoring Coronavirus Stories. These Citizens Are Fighting Back. | NYT News,1.2M views,The New York Times,2 weeks ago,4:09,https://www.youtube.com/watch?v=m5fsidSOJMw,2.54M,"23,722","1,300"
144,"Coronavirus outbreak: President Donald Trump confirms 1st death in U.S., talks virus response",641K views,Global News,Streamed 1 week ago,52:20:00,https://www.youtube.com/watch?v=Cn9AZKmuMZI,1.21M,"5,792","2,135"
145,CDC warns coronavirus outbreak will worsen,710K views,ABC News,1 week ago,4:25,https://www.youtube.com/watch?v=byU_N9iHBFY,7.86M,"6,563",466
146,Get the facts on coronavirus,2.7M views,CBC News,1 month ago,5:10,https://www.youtube.com/watch?v=kIL5m5XznNY,1.85M,"36,684","1,521"
147,Coronavirus explained,271K views,CNET,1 week ago,6:03,https://www.youtube.com/watch?v=hZDX08RcPmg,2.54M,"3,435",353
148,"China Says Coronavirus Cases Rise to 70,548, Deaths Hit 1,770",1M views,Bloomberg Markets and Finance,3 weeks ago,6:44,https://www.youtube.com/watch?v=yWhYloc7164,557K,"4,415",694
149,Coronavirus: First children infected in Italy - BBC News,998K views,BBC News,1 week ago,7:50,https://www.youtube.com/watch?v=i0ShJruunDE,6.53M,"7,836",534
